00:00.0 Host bridge: Intel Corporation Device 2280 (rev 22)
	Subsystem: Intel Corporation Device 7270
	Control: I/O+ Mem+ BusMaster+ SpecCycle- MemWINV- VGASnoop- ParErr- Stepping- SERR- FastB2B- DisINTx-
	Status: Cap- 66MHz- UDF- FastB2B- ParErr- DEVSEL=fast >TAbort- <TAbort- <MAbort- >SERR- <PERR- INTx-
	Latency: 0
	Kernel driver in use: iosf_mbi_pci

00:02.0 VGA compatible controller: Intel Corporation Device 22b0 (rev 22) (prog-if 00 [VGA controller])
	Subsystem: Intel Corporation Device 7270
	Control: I/O+ Mem+ BusMaster+ SpecCycle- MemWINV- VGASnoop- ParErr- Stepping- SERR- FastB2B- DisINTx+
	Status: Cap+ 66MHz- UDF- FastB2B- ParErr- DEVSEL=fast >TAbort- <TAbort- <MAbort- >SERR- <PERR- INTx-
	Latency: 0
	Interrupt: pin A routed to IRQ 297
	Region 0: Memory at 90000000 (64-bit, non-prefetchable) [size=16M]
	Region 2: Memory at 80000000 (64-bit, prefetchable) [size=256M]
	Region 4: I/O ports at 1000 [size=64]
	Expansion ROM at <unassigned> [disabled]
	Capabilities: [d0] Power Management version 2
		Flags: PMEClk- DSI+ D1- D2- AuxCurrent=0mA PME(D0-,D1-,D2-,D3hot-,D3cold-)
		Status: D0 NoSoftRst- PME-Enable- DSel=0 DScale=0 PME-
	Capabilities: [90] MSI: Enable+ Count=1/1 Maskable- 64bit-
		Address: fee0400c  Data: 41b3
	Capabilities: [b0] Vendor Specific Information: Len=07 <?>
	Kernel driver in use: i915
	Kernel modules: i915

00:03.0 Multimedia controller: Intel Corporation Device 22b8 (rev 22)
	Subsystem: Intel Corporation Device 7270
	Control: I/O- Mem+ BusMaster+ SpecCycle- MemWINV- VGASnoop- ParErr- Stepping- SERR- FastB2B- DisINTx-
	Status: Cap+ 66MHz- UDF- FastB2B- ParErr- DEVSEL=fast >TAbort- <TAbort- <MAbort- >SERR- <PERR- INTx-
	Latency: 0
	Interrupt: pin A routed to IRQ 255
	Region 0: Memory at 91000000 (32-bit, non-prefetchable) [size=4M]
	Capabilities: [80] Power Management version 2
		Flags: PMEClk- DSI+ D1- D2- AuxCurrent=0mA PME(D0-,D1-,D2-,D3hot-,D3cold-)
		Status: D0 NoSoftRst- PME-Enable- DSel=0 DScale=0 PME-
	Capabilities: [90] MSI: Enable- Count=1/1 Maskable- 64bit-
		Address: 00000000  Data: 0000

00:0b.0 Signal processing controller: Intel Corporation Device 22dc (rev 22)
	Subsystem: Device 7270:8086
	Control: I/O+ Mem+ BusMaster+ SpecCycle- MemWINV- VGASnoop- ParErr- Stepping- SERR- FastB2B- DisINTx+
	Status: Cap+ 66MHz- UDF- FastB2B- ParErr- DEVSEL=fast >TAbort- <TAbort- <MAbort- >SERR- <PERR- INTx-
	Latency: 0
	Interrupt: pin A routed to IRQ 298
	Region 0: Memory at 91818000 (64-bit, non-prefetchable) [size=4K]
	Capabilities: [40] MSI: Enable+ Count=1/1 Maskable- 64bit-
		Address: fee0f00c  Data: 41d3
	Capabilities: [50] Power Management version 3
		Flags: PMEClk- DSI- D1- D2- AuxCurrent=0mA PME(D0-,D1-,D2-,D3hot-,D3cold-)
		Status: D0 NoSoftRst+ PME-Enable- DSel=0 DScale=0 PME-
	Kernel driver in use: proc_thermal
	Kernel modules: processor_thermal_device

00:14.0 USB controller: Intel Corporation Device 22b5 (rev 22) (prog-if 30 [XHCI])
	Subsystem: Intel Corporation Device 7270
	Control: I/O- Mem+ BusMaster+ SpecCycle- MemWINV- VGASnoop- ParErr- Stepping- SERR- FastB2B- DisINTx+
	Status: Cap+ 66MHz- UDF- FastB2B+ ParErr- DEVSEL=medium >TAbort- <TAbort- <MAbort- >SERR- <PERR- INTx-
	Latency: 0
	Interrupt: pin A routed to IRQ 296
	Region 0: Memory at 91800000 (64-bit, non-prefetchable) [size=64K]
	Capabilities: [70] Power Management version 2
		Flags: PMEClk- DSI- D1- D2- AuxCurrent=375mA PME(D0-,D1-,D2-,D3hot+,D3cold+)
		Status: D0 NoSoftRst+ PME-Enable- DSel=0 DScale=0 PME-
	Capabilities: [80] MSI: Enable+ Count=1/8 Maskable- 64bit+
		Address: 00000000fee0200c  Data: 4193
	Kernel driver in use: xhci_hcd

00:1a.0 Encryption controller: Intel Corporation Device 2298 (rev 22)
	Subsystem: Intel Corporation Device 7270
	Control: I/O- Mem+ BusMaster+ SpecCycle- MemWINV- VGASnoop- ParErr- Stepping- SERR+ FastB2B- DisINTx+
	Status: Cap+ 66MHz- UDF- FastB2B- ParErr- DEVSEL=fast >TAbort- <TAbort- <MAbort- >SERR- <PERR- INTx-
	Latency: 0, Cache Line Size: 64 bytes
	Interrupt: pin A routed to IRQ 299
	Region 0: Memory at 91700000 (32-bit, non-prefetchable) [size=1M]
	Region 1: Memory at 91600000 (32-bit, non-prefetchable) [size=1M]
	Capabilities: [80] Power Management version 3
		Flags: PMEClk- DSI- D1- D2- AuxCurrent=0mA PME(D0+,D1-,D2-,D3hot+,D3cold-)
		Status: D0 NoSoftRst+ PME-Enable- DSel=0 DScale=0 PME-
	Capabilities: [a0] MSI: Enable+ Count=1/1 Maskable- 64bit-
		Address: fee0f00c  Data: 41e3
	Kernel driver in use: mei_txe
	Kernel modules: mei_txe

00:1f.0 ISA bridge: Intel Corporation Device 229c (rev 22)
	Subsystem: Intel Corporation Device 7270
	Control: I/O+ Mem+ BusMaster+ SpecCycle- MemWINV- VGASnoop- ParErr- Stepping- SERR+ FastB2B- DisINTx-
	Status: Cap+ 66MHz- UDF- FastB2B- ParErr- DEVSEL=medium >TAbort- <TAbort- <MAbort- >SERR- <PERR- INTx-
	Latency: 0
	Capabilities: [e0] Vendor Specific Information: Len=0c <?>
	Kernel driver in use: lpc_ich
	Kernel modules: lpc_ich
